{
  "id": "raw_2026_04_17_static_cninfo_com_cn_927dea0520",
  "artifactType": "filing",
  "title": "沪硅产业2025年年度利润分配方案公告",
  "publisher": "沪硅产业",
  "url": "http://static.cninfo.com.cn/finalpage/2026-04-17/1225114296.PDF",
  "sourceId": "src_static_cninfo_com_cn_927dea0520",
  "fetchRunId": "fetch_2026_04_17_static_cninfo_com_cn_927dea0520",
  "publishedAt": "2026-04-17",
  "firstSeenAt": "2026-07-23T09:50:52+08:00",
  "capturedAt": "2026-07-23T09:50:52+08:00",
  "contentHash": "sha256:229081725bdc9c3464f04f286dcc827a2eeaffb58815e16c59f6a5772d4f7359",
  "storagePath": "raw_artifacts/payloads/raw_2026_04_17_static_cninfo_com_cn_927dea0520.json",
  "entityIds": [
    "national_silicon"
  ],
  "claimIds": [
    "claim_2026_04_17_filing_655bc6b4a0"
  ],
  "status": "active",
  "notes": "Official News Intake v0 from announcement_candidate_7c14222b0d516d1e; listSourceId=src_cninfo_688126_announcements."
}
