{
  "id": "raw_2026_06_26_static_cninfo_com_cn_e8e7862dca",
  "artifactType": "filing",
  "title": "关于持股5%以上股东股份变动比例触及5%整数倍暨披露权益变动报告书的提示性公告",
  "publisher": "通富微电",
  "url": "http://static.cninfo.com.cn/finalpage/2026-06-26/1225388684.PDF",
  "sourceId": "src_static_cninfo_com_cn_e8e7862dca",
  "fetchRunId": "fetch_2026_06_26_static_cninfo_com_cn_e8e7862dca",
  "publishedAt": "2026-06-26",
  "firstSeenAt": "2026-07-22T16:15:52+08:00",
  "capturedAt": "2026-07-22T16:15:52+08:00",
  "contentHash": "sha256:4eaa557febe7820a056f16e52c172d346732d3fafe7c5b271192950b319def0c",
  "storagePath": "raw_artifacts/payloads/raw_2026_06_26_static_cninfo_com_cn_e8e7862dca.json",
  "entityIds": [
    "tongfu_microelectronics"
  ],
  "claimIds": [
    "claim_2026_06_26_filing_4e1cb9bad8"
  ],
  "status": "active",
  "notes": "Official News Intake v0 from announcement_candidate_3707fe68af0d2710; listSourceId=src_cninfo_002156_announcements."
}
