{
  "id": "raw_2026_05_30_static_cninfo_com_cn_c8f4ec707e",
  "artifactType": "filing",
  "title": "华虹半导体有限公司发行股份购买资产并募集配套资金暨关联交易报告书摘要（修订稿）",
  "publisher": "华虹公司",
  "url": "http://static.cninfo.com.cn/finalpage/2026-05-30/1225340254.PDF",
  "sourceId": "src_static_cninfo_com_cn_c8f4ec707e",
  "fetchRunId": "fetch_2026_05_30_static_cninfo_com_cn_c8f4ec707e",
  "publishedAt": "2026-05-30",
  "firstSeenAt": "2026-07-23T09:50:52+08:00",
  "capturedAt": "2026-07-23T09:50:52+08:00",
  "contentHash": "sha256:15ad1f99e7a5a24adf6b7c57c0cf7103e5368dce65a9e21d9fa0d5263a29235f",
  "storagePath": "raw_artifacts/payloads/raw_2026_05_30_static_cninfo_com_cn_c8f4ec707e.json",
  "entityIds": [
    "huahong_semiconductor"
  ],
  "claimIds": [
    "claim_2026_05_30_filing_e3b4ca4b72"
  ],
  "status": "active",
  "notes": "Official News Intake v0 from announcement_candidate_678fd9eaa5e4da1d; listSourceId=src_cninfo_688347_announcements."
}
