{
  "id": "raw_2026_04_28_static_cninfo_com_cn_29836670e8",
  "artifactType": "filing",
  "title": "鸣志电器2026年第一季度报告",
  "publisher": "鸣志电器",
  "url": "http://static.cninfo.com.cn/finalpage/2026-04-28/1225218460.PDF",
  "sourceId": "src_static_cninfo_com_cn_29836670e8",
  "fetchRunId": "fetch_2026_04_28_static_cninfo_com_cn_29836670e8",
  "publishedAt": "2026-04-28",
  "firstSeenAt": "2026-07-23T16:16:14+08:00",
  "capturedAt": "2026-07-23T16:16:14+08:00",
  "contentHash": "sha256:8d526235e57248f037574ae233b2db451a29d492cb785f6b680e75df67497ad9",
  "storagePath": "raw_artifacts/payloads/raw_2026_04_28_static_cninfo_com_cn_29836670e8.json",
  "entityIds": [
    "moons"
  ],
  "claimIds": [
    "claim_2026_04_28_filing_a428626614"
  ],
  "status": "active",
  "notes": "Official News Intake v0 from announcement_candidate_59c06b21fc62026e; listSourceId=src_cninfo_603728_announcements."
}
