{
  "id": "raw_2026_07_08_static_cninfo_com_cn_8fdf64702e",
  "artifactType": "filing",
  "title": "港股公告：证券变动月报表",
  "publisher": "华虹宏力",
  "url": "http://static.cninfo.com.cn/finalpage/2026-07-08/1225414067.PDF",
  "sourceId": "src_static_cninfo_com_cn_8fdf64702e",
  "fetchRunId": "fetch_2026_07_08_static_cninfo_com_cn_8fdf64702e",
  "publishedAt": "2026-07-08",
  "firstSeenAt": "2026-07-23T09:31:19+08:00",
  "capturedAt": "2026-07-23T09:31:19+08:00",
  "contentHash": "sha256:4f8f3880fd5d7715805ca147c93f0368c50698fb64ac4dfabbffe45aa81bf08c",
  "storagePath": "raw_artifacts/payloads/raw_2026_07_08_static_cninfo_com_cn_8fdf64702e.json",
  "entityIds": [
    "huahong_semiconductor"
  ],
  "claimIds": [
    "claim_2026_07_08_filing_47f6ff2101"
  ],
  "status": "active",
  "notes": "Official News Intake v0 from announcement_candidate_a1936f658c7a5dd0; listSourceId=src_cninfo_688347_announcements."
}
