{
  "id": "raw_2026_08_20_static_cninfo_com_cn_c8729c07c7",
  "artifactType": "filing",
  "title": "关于增加2026年度日常关联交易预计额度的公告",
  "publisher": "中微公司",
  "url": "http://static.cninfo.com.cn/finalpage/2026-08-20/1225482917.PDF",
  "sourceId": "src_static_cninfo_com_cn_c8729c07c7",
  "fetchRunId": "fetch_2026_08_20_static_cninfo_com_cn_c8729c07c7",
  "publishedAt": "2026-08-20",
  "firstSeenAt": "2026-08-20T16:16:17+08:00",
  "capturedAt": "2026-08-20T16:16:17+08:00",
  "contentHash": "sha256:a58b69005a393fc32ff46d7e9ee93e6188f7f47c9e159fadedd2ae7996852b85",
  "storagePath": "raw_artifacts/payloads/raw_2026_08_20_static_cninfo_com_cn_c8729c07c7.json",
  "entityIds": [
    "amec"
  ],
  "claimIds": [
    "claim_2026_08_20_filing_08e36a9025"
  ],
  "status": "active",
  "notes": "Official News Intake v0 from announcement_candidate_be77be839b45b33f; listSourceId=src_cninfo_688012_announcements."
}
