{
  "id": "raw_2026_08_18_static_cninfo_com_cn_02d86e0e37",
  "artifactType": "filing",
  "title": "2026年第一次临时股东会法律意见书",
  "publisher": "北方华创",
  "url": "http://static.cninfo.com.cn/finalpage/2026-08-18/1225477024.PDF",
  "sourceId": "src_static_cninfo_com_cn_02d86e0e37",
  "fetchRunId": "fetch_2026_08_18_static_cninfo_com_cn_02d86e0e37",
  "publishedAt": "2026-08-18",
  "firstSeenAt": "2026-08-18T16:15:56+08:00",
  "capturedAt": "2026-08-18T16:15:56+08:00",
  "contentHash": "sha256:159d11d49093ebcbdd7ba02583a54fe5dc31ab845a58aa89061a78379d464791",
  "storagePath": "raw_artifacts/payloads/raw_2026_08_18_static_cninfo_com_cn_02d86e0e37.json",
  "entityIds": [
    "naura"
  ],
  "claimIds": [
    "claim_2026_08_18_filing_a48f396835"
  ],
  "status": "active",
  "notes": "Official News Intake v0 from announcement_candidate_65bf3d1d62a6646a; listSourceId=src_cninfo_002371_announcements."
}
