{
  "id": "raw_2026_06_23_orbbec_com_cn_8617abd107",
  "artifactType": "news_page",
  "title": "一“坪”看懂奥比中光最新割草机视觉方案",
  "publisher": "奥比中光科技集团股份有限公司",
  "url": "https://www.orbbec.com.cn/index/News/info.html?cate=31&id=372",
  "sourceId": "src_orbbec_com_cn_8617abd107",
  "fetchRunId": "fetch_2026_06_23_orbbec_com_cn_8617abd107",
  "publishedAt": "2026-06-23",
  "firstSeenAt": "2026-07-06T12:02:00+08:00",
  "capturedAt": "2026-07-06T12:02:00+08:00",
  "contentHash": "sha256:e4a9c8d4a127344069a1e78b23981e839aa1055dff8c1eddbe02dbb698bdd480",
  "storagePath": "raw_artifacts/payloads/raw_2026_06_23_orbbec_com_cn_8617abd107.json",
  "entityIds": [
    "orbbec"
  ],
  "claimIds": [
    "claim_2026_06_23_other_5757f0f7f1"
  ],
  "status": "active",
  "notes": "Official News Intake v0 from news_candidate_b0eddc1553c925ec; listSourceId=src_orbbec_official_news."
}
