{
  "id": "raw_2026_07_30_static_cninfo_com_cn_14dea05eb6",
  "artifactType": "filing",
  "title": "2026年第三次临时股东会决议公告",
  "publisher": "兴业银锡",
  "url": "http://static.cninfo.com.cn/finalpage/2026-07-30/1225447054.PDF",
  "sourceId": "src_static_cninfo_com_cn_14dea05eb6",
  "fetchRunId": "fetch_2026_07_30_static_cninfo_com_cn_14dea05eb6",
  "publishedAt": "2026-07-30",
  "firstSeenAt": "2026-07-30T16:16:17+08:00",
  "capturedAt": "2026-07-30T16:16:17+08:00",
  "contentHash": "sha256:afa2c31f34219b47ad7e87845be83549806ebd669379e3686c820234ca47e760",
  "storagePath": "raw_artifacts/payloads/raw_2026_07_30_static_cninfo_com_cn_14dea05eb6.json",
  "entityIds": [
    "xingye_silver"
  ],
  "claimIds": [
    "claim_2026_07_30_filing_24183ca31f"
  ],
  "status": "active",
  "notes": "Official News Intake v0 from announcement_candidate_1c577e1d8123e3d7; listSourceId=src_cninfo_000426_announcements."
}
