{
  "id": "raw_2026_06_02_static_cninfo_com_cn_04f3c3f6c0",
  "artifactType": "filing",
  "title": "澜起科技关于2025年第二次回购A股股份方案回购股份进展的公告",
  "publisher": "澜起科技",
  "url": "http://static.cninfo.com.cn/finalpage/2026-06-02/1225344080.PDF",
  "sourceId": "src_static_cninfo_com_cn_04f3c3f6c0",
  "fetchRunId": "fetch_2026_06_02_static_cninfo_com_cn_04f3c3f6c0",
  "publishedAt": "2026-06-02",
  "firstSeenAt": "2026-07-23T09:50:52+08:00",
  "capturedAt": "2026-07-23T09:50:52+08:00",
  "contentHash": "sha256:6abe73353fa9c1da0658ce197f977db7ddf28701263db25f1025845e133f715d",
  "storagePath": "raw_artifacts/payloads/raw_2026_06_02_static_cninfo_com_cn_04f3c3f6c0.json",
  "entityIds": [
    "montage_technology"
  ],
  "claimIds": [
    "claim_2026_06_02_filing_6048e2f85a"
  ],
  "status": "active",
  "notes": "Official News Intake v0 from announcement_candidate_d3065654b3404b63; listSourceId=src_cninfo_688008_announcements."
}
